{
  "type": "object",
  "additionalProperties": false,
  "required": [
    "manifest_version",
    "export_format",
    "process_name",
    "source_export_version",
    "sections"
  ],
  "properties": {
    "manifest_version": {
      "const": "1.0"
    },
    "export_format": {
      "const": "ti_section_files_v1"
    },
    "process_name": {
      "type": [
        "string",
        "null"
      ]
    },
    "source_export_version": {
      "type": [
        "string",
        "null"
      ]
    },
    "sections": {
      "type": "object",
      "minProperties": 1,
      "additionalProperties": false,
      "properties": {
        "prolog": {
          "type": "object",
          "additionalProperties": false,
          "required": [
            "path",
            "sha256"
          ],
          "properties": {
            "path": {
              "type": "string",
              "minLength": 1
            },
            "sha256": {
              "type": "string",
              "pattern": "^[a-f0-9]{64}$"
            }
          }
        },
        "metadata": {
          "type": "object",
          "additionalProperties": false,
          "required": [
            "path",
            "sha256"
          ],
          "properties": {
            "path": {
              "type": "string",
              "minLength": 1
            },
            "sha256": {
              "type": "string",
              "pattern": "^[a-f0-9]{64}$"
            }
          }
        },
        "data": {
          "type": "object",
          "additionalProperties": false,
          "required": [
            "path",
            "sha256"
          ],
          "properties": {
            "path": {
              "type": "string",
              "minLength": 1
            },
            "sha256": {
              "type": "string",
              "pattern": "^[a-f0-9]{64}$"
            }
          }
        },
        "epilog": {
          "type": "object",
          "additionalProperties": false,
          "required": [
            "path",
            "sha256"
          ],
          "properties": {
            "path": {
              "type": "string",
              "minLength": 1
            },
            "sha256": {
              "type": "string",
              "pattern": "^[a-f0-9]{64}$"
            }
          }
        }
      }
    }
  },
  "$schema": "https://json-schema.org/draft/2020-12/schema",
  "$id": "urn:ssis-migration:schema:tm1_ti_manifest:1.0"
}
